{
 "id": "M5978",
 "game": "c64/trek",
 "category": {
  "goal": "baseline"
 },
 "authors": [
  {
   "user": "nymx"
  }
 ],
 "tools": [],
 "movie": {
  "file": "M5978.bk2",
  "format": "bk2",
  "frames": 9215,
  "fps": 59.826089499853765,
  "rerecords": 1287,
  "start": "power-on"
 },
 "thumbnail": "thumb.jpg",
 "contract": {
  "emulator": "BizHawk 2.9.1",
  "files": [
   {
    "name": "1984-10.d64",
    "sha1": "2573edf9ad2e55f3308703721a30f4689d9b3e48"
   }
  ]
 },
 "status": {
  "reproduced": "imported",
  "verified": "imported"
 },
 "imported": {
  "source": "https://tasvideos.org/5978M",
  "importedBy": "nymx",
  "importedAt": "2026-09-28"
 },
 "encodes": [
  {
   "kind": "youtube",
   "url": "https://www.youtube.com/watch?v=lOZI_xxHcUg"
  }
 ],
 "submitted": "2024-06-05T06:48:24.209247",
 "attachments": [],
 "forum": {
  "topicId": 1747,
  "url": "https://forum.toolassisted.run/t/1747"
 }
}
